,created_at,text,in_reply_to_tweet_id,retweet_count,reply_count,like_count,Cleaned,label_predict,py_lib Predictions
1487,2022-10-06T09:17:09.000Z,"@elonmusk Hey Elon Musk, what's up with the amount Tesla ordered and made? And what about state voting? Do you approve?",1576994262226702336,0,0,0, hey elon musk whats amount tesla ordered made state voting approve,0,1
1488,2022-10-06T09:16:53.000Z,@elonmusk Manai meitai bija taisnība. Tu esi slikts cilvēks.,1576994262226702336,0,0,0, manai meitai bija taisnba tu esi slikts cilvks,0,1
1489,2022-10-06T09:16:05.000Z,"@elonmusk dear Elon, usually when a person doesn't like the country he lives in, he packs up and moves to another country instead of asking for its territory to be annexed to another country.  Do not write what you do not understand!",1576994262226702336,0,0,0, dear elon usually person like country lives in packs moves another country instead asking territory annexed another country write understand,0,0
1490,2022-10-06T09:15:38.000Z,"@elonmusk did you get the new vaccine from Putin? Apparently the propaganda works well, since it got to you too.",1576994262226702336,0,0,0, get new vaccine putin apparently propaganda works well since got too,0,0
1491,2022-10-06T09:13:45.000Z,"@elonmusk We support you from Czech republic, because nobody speaks about peace 🙏
PEACE TO UKRAINE",1576994262226702336,0,0,0, support czech republic nobody speaks peace  peace ukraine,1,1
1492,2022-10-06T09:13:23.000Z,"@elonmusk Such a frustration! A person like Elon Musk who is the epitome of Free World gets in league with the worst enemies of democracy, new Nazis, international criminals  and callous mass murderers. Such a joke!",1576994262226702336,0,0,0, frustration person like elon musk epitome free world gets league worst enemies democracy new nazis international criminals callous mass murderers joke,0,0
1493,2022-10-06T09:13:21.000Z,@elonmusk You do realise if they didn't vote Russia they would get shot. Also some Russians also voted.,1576994262226702336,0,0,0, realise vote russia would get shot also russians also voted,0,1
1494,2022-10-06T09:12:35.000Z,"@elonmusk Hey Elon, I'm a resident of Ukraine and own property there. Ask me anything. Really. 

If I can't answer it, I'll introduce you to a Ukrainian who can. 

Please stop getting your ideas from whoever is feeding them to you now, or from wikipedia, reddit and other bs sources.",1576994262226702336,0,1,11, hey elon im resident ukraine property there ask anything really cant answer it ill introduce ukrainian can please stop getting ideas whoever feeding now wikipedia reddit bs sources,0,0
1495,2022-10-06T09:11:03.000Z,"@elonmusk Elon, what if people who work at your companies voted to change the leader(you) cuz they just don’t like you or misunderstand your goals(for instance) or voted to give up on making details for Tesla, would this poll work then?.. for you in particular?",1576994262226702336,0,0,0, elon people work companies voted change leaderyou cuz dont like misunderstand goalsfor instance voted give making details tesla would poll work then particular,0,1
1496,2022-10-06T09:09:59.000Z,"@elonmusk Profering ambiguous ""solutions"" at this time is not helpful.  As a good negotiator you should know. At this time, it's important to give Ukraine all advantage possible.  This can even lead to to the collapse of the Russian hunta, which will open up new possibilities entirely.",1576994262226702336,0,0,0, profering ambiguous solutions time helpful good negotiator know time important give ukraine advantage possible even lead collapse russian hunta open new possibilities entirely,1,0
1497,2022-10-06T09:09:59.000Z,"@elonmusk Let’s try this then: the will of the people who live in the Miami, Alakska etc should decide whether they’re part of Russia or USA or Mexico",1576994262226702336,0,0,0, lets try then people live miami alakska etc decide whether theyre part russia usa mexico,0,0
1498,2022-10-06T09:09:35.000Z,@elonmusk https://t.co/xBnnXkCtsf,1576994262226702336,0,0,0,,0,Neutral
1499,2022-10-06T09:08:54.000Z,"@elonmusk What about those, who lived there but evacuated from war? You put their wishes aside?",1576994262226702336,0,0,0, those lived evacuated war put wishes aside,1,0
1500,2022-10-06T09:08:31.000Z,"@elonmusk Elon, why do you inspire people that some Ukrainians want to go to russia?!Let's just imagine… Elon, you are Ukrainian, and what would you choose?  Join russia or be independent and under the protection of NATO.  I read Ashley Vance's book and I know how you think about *ussians",1576994262226702336,0,0,0, elon inspire people ukrainians want go russialets imagine elon ukrainian would choose join russia independent protection nato read ashley vances book know think ussians,0,1
1501,2022-10-06T09:08:28.000Z,"@elonmusk Hey, Elon, in your logic, you should provide referendums in California joining Mexico. Or about the allocation of Oklahoma as separate country for Indians. Why not.",1576994262226702336,0,0,0, hey elon logic provide referendums california joining mexico allocation oklahoma separate country indians not,0,0
1502,2022-10-06T09:07:41.000Z,@elonmusk But pro-ukrainian citizen's who support Ukraine were killed in Donbas y Russian forces &amp; russian nazis. It was genocide of ukrainian nation. Shame of you.,1576994262226702336,0,0,2, proukrainian citizens support ukraine killed donbas russian forces amp russian nazis genocide ukrainian nation shame you,0,0
1503,2022-10-06T09:07:25.000Z,"@elonmusk There is no regional review for this vote, which seems to be of little significance",1576994262226702336,0,0,0, regional review vote seems little significance,0,0
1504,2022-10-06T09:07:24.000Z,@elonmusk Russian new nazis must and will be defeated! Freedom and Justice will prevail!,1576994262226702336,0,0,0, russian new nazis must defeated freedom justice prevail,0,1
1505,2022-10-06T09:07:15.000Z,@elonmusk If I want to live in another country I pack my bags and move to another country. This is how it works.,1576994262226702336,0,0,1, want live another country pack bags move another country works,0,0
1506,2022-10-06T09:05:42.000Z,"@elonmusk And just how do you propose to measure 'the will of the people'? Will all those who have fled the fighting be allowed to vote? How? What about the invading forces - should they vote as they inhabit the land now? How do you prevent vote coercion? Impossible. 
A half arsed scheme!",1576994262226702336,0,0,0, propose measure the people fled fighting allowed vote how invading forces  vote inhabit land now prevent vote coercion impossible half arsed scheme,0,0
1507,2022-10-06T09:05:39.000Z,"@elonmusk Maybe you're willing to put some effort, money and all other helpfull things to give the American land back to it's owners, the ""Great Indian empire""? Or is the point to keep only your own wealth, prosperity and distant knowledge safe?",1576994262226702336,0,0,0, maybe willing put effort money helpfull things give american land back owners great indian empire point keep wealth prosperity distant knowledge safe,1,0
1508,2022-10-06T09:04:59.000Z,@elonmusk Fortnite,1576994262226702336,0,1,0, fortnite,0,0
1509,2022-10-06T09:04:51.000Z,@elonmusk Must be a need for a joint SpaceX-Russia mission!!!!,1576994262226702336,0,0,0, must need joint spacexrussia mission,0,1
1510,2022-10-06T09:04:11.000Z,"@elonmusk Lets try this. You get your head out of its natural habitat, which clearly seams to be your ass",1576994262226702336,0,0,0, lets try this get head natural habitat clearly seams ass,0,1
1511,2022-10-06T09:04:10.000Z,"@elonmusk It’s so horrifying that the future of my country is discussed by some morons from US, even not into politics. The only guys who really understand what’s going on is US military.",1576994262226702336,0,0,0, its horrifying future country discussed morons us even politics guys really understand whats going us military,0,0
1512,2022-10-06T09:04:08.000Z,"@elonmusk Ok, then maybe let's do the same to all contries starting with USA?
Firstly neighbor countries will invade. Then we will do referendum on occupaied territories to ""the name of peace"" and make new borders. Interesting how much states will have USA after that? https://t.co/FigpokFiA6",1576994262226702336,2,1,2, ok maybe lets contries starting usa firstly neighbor countries invade referendum occupaied territories the name peace make new borders interesting much states usa that,1,0
1513,2022-10-06T09:03:18.000Z,@elonmusk https://t.co/DKgA3pJdYS,1576994262226702336,0,0,1,,0,Neutral
1514,2022-10-06T09:02:45.000Z,@elonmusk https://t.co/00b8eWzYE5,1576994262226702336,0,0,0,,0,Neutral
1515,2022-10-06T09:02:41.000Z,@elonmusk https://t.co/7pdZSTc3ng,1576994262226702336,0,0,0,,0,Neutral
1516,2022-10-06T09:02:37.000Z,@elonmusk https://t.co/i1M0ItvlYj,1576994262226702336,0,0,0,,0,Neutral
1517,2022-10-06T09:01:57.000Z,"@elonmusk Hazara people need your support please stand with Hazara nation in Afghanistan 🇦🇫 
#StopHazaraGenocide",1576994262226702336,0,0,0, hazara people need support please stand hazara nation afghanistan  stophazaragenocide,1,0
1518,2022-10-06T09:01:23.000Z,@elonmusk as a resident of the Crimea I am writing Crimea is Russia. The people chose not at gunpoint and torture. Themselves voted all who are tired of Ukraine corruption lies and delusional ideologies,1576994262226702336,0,0,0, resident crimea writing crimea russia people chose gunpoint torture voted tired ukraine corruption lies delusional ideologies,0,0
1519,2022-10-06T09:00:42.000Z,@elonmusk So it’s legal to make “referendum” about separation space x - from your company ? Lets go and vote then?,1576994262226702336,0,0,0, its legal make referendum separation space x  company  lets go vote then,1,1
1520,2022-10-06T09:00:40.000Z,"@elonmusk If citizen of any country wants to live somewhere else - he/she should buy ticket, pack their luggage and move there.",1576994262226702336,0,0,0, citizen country wants live somewhere else  heshe buy ticket pack luggage move there,0,0
1521,2022-10-06T09:00:29.000Z,@elonmusk Ilona Ilona you are such a disappointment!💃💃💃,1576994262226702336,0,0,0, ilona ilona disappointment,0,0
1522,2022-10-06T08:58:37.000Z,"@elonmusk Matthew 5:40 (KJV)  And if any man will sue thee at the law, and take away thy coat, let him have thy cloke also.",1576994262226702336,0,0,0, matthew  kjv man sue thee law take away thy coat let thy cloke also,0,0
1523,2022-10-06T08:57:18.000Z,"@elonmusk If you live in California, and you love Mexico, you don’t make California a part of Mexico, you just bring you stuff and move to another country.",1576994262226702336,0,0,1, live california love mexico dont make california part mexico bring stuff move another country,1,1
1524,2022-10-06T08:56:57.000Z,"@elonmusk dear Elon, what do you think if a vote is held in the Russian Federation or Mexico on joining the United States, how many people will vote for joining?  I think there will be a majority",1576994262226702336,0,0,0, dear elon think vote held russian federation mexico joining united states many people vote joining think majority,0,0
1525,2022-10-06T08:56:11.000Z,@elonmusk Who are you to decide?,1576994262226702336,0,0,0, decide,0,1
1526,2022-10-06T08:56:11.000Z,"@elonmusk Thanks! If only we had a billionaire in power to solve all the world's problems as easily and simply as you can!.. Oh wait, there is a billionaire in power in Russia.. And the last billionaire president of the US worked out so well. Hmm, you guys are good talkers, bad strategists",1576994262226702336,0,0,0, thanks billionaire power solve worlds problems easily simply can oh wait billionaire power russia last billionaire president us worked well hmm guys good talkers bad strategists,1,0
1527,2022-10-06T08:55:15.000Z,"@elonmusk I guess you did not hear about #GenocideOfUkrainians and Crimean Tatars through deportation from Eastern Ukraine and Crimea in cattle carriages to the east of russia and then resetting ruzzians on their property, their land? 

You display typical mindset of a colonizer @elonmusk",1576994262226702336,0,0,0, guess hear genocideofukrainians crimean tatars deportation eastern ukraine crimea cattle carriages east russia resetting ruzzians property land display typical mindset colonizer ,0,0
1528,2022-10-06T08:55:15.000Z,"@elonmusk Elon, unfortunately,  you can't understand one thing, all that you say about the upper, not working with Putin, he wants Ukraine to cease to exist as a country. All truce is a little rest before the next war. He wants it to get more power for his forces and start a fight again.",1576994262226702336,0,0,0, elon unfortunately cant understand one thing say upper working putin wants ukraine cease exist country truce little rest next war wants get power forces start fight again,0,0
1529,2022-10-06T08:55:12.000Z,@elonmusk No of course not 🙄 This is typical superior white man bs - pardon my French 🙈,1576994262226702336,0,0,0, course  typical superior white man bs  pardon french ,0,1
1530,2022-10-06T08:54:37.000Z,@elonmusk What did Poroshenko say about people in east Ukraine?,1576994262226702336,0,0,0, poroshenko say people east ukraine,0,0
1531,2022-10-06T08:54:17.000Z,@elonmusk https://t.co/epRqxFkWgd,1576994262226702336,0,0,1,,0,Neutral
1532,2022-10-06T08:54:07.000Z,"@elonmusk You fucking asshole, you dont have a logic, you should retire. Lets try this then: Elon is out of his mind -100%",1576994262226702336,0,0,0, fucking asshole dont logic retire lets try then elon mind ,0,0
1533,2022-10-06T08:53:17.000Z,"@elonmusk A beautiful utopia that contradicts modern ""international law"". Walk before running. Change the principles of international law before implementing humanity.",1576994262226702336,0,0,0, beautiful utopia contradicts modern international law walk running change principles international law implementing humanity,1,1
1534,2022-10-06T08:52:47.000Z,"@elonmusk Stop it.
People who like russia may go there and enjoy their living there. 
Ukraine is a sovereign state (*with Crimea and Donbass).
This is not a theme to discuss.",1576994262226702336,0,0,2, stop it people like russia may go enjoy living there ukraine sovereign state with crimea donbass theme discuss,1,0
1535,2022-10-06T08:52:25.000Z,"@elonmusk Please do not embarrass yourself @elonmusk. The will of people who lived in Donbas and Crimea was decided in 1991 @elonmusk, they voted for independent Ukraine.",1576994262226702336,0,0,1, please embarrass  people lived donbas crimea decided   voted independent ukraine,0,0
1536,2022-10-06T08:52:12.000Z,"@elonmusk Ilon, this your opinion is stillborn and poor. Ukraine will win this war, because we protect our identity.",1576994262226702336,0,0,1, ilon opinion stillborn poor ukraine win war protect identity,0,0
1537,2022-10-06T08:52:09.000Z,@elonmusk 😊,1576994262226702336,0,0,0, ,0,Neutral
1538,2022-10-06T08:51:00.000Z,"@elonmusk *YES* /*NO* for what-Russia or Ukraine? You can't even formulate a simplest question. There wasn't any *Russian Federation* in 1783, In Donbass, and in the South of Ukraine the majority is UKRAINIAN, not Russian!!! I can't believe that such a moron became such a successful busine",1576994262226702336,0,0,0, yes no whatrussia ukraine cant even formulate simplest question russian federation  donbass south ukraine majority ukrainian russian cant believe moron became successful busine,1,0
1539,2022-10-06T08:50:54.000Z,"@elonmusk What about people who lived there before and run away russian invaders, what about 8 year terror since 2014 against pro-ukrainian part of Donbass? And who will pay for all war crimes?",1576994262226702336,0,0,0, people lived run away russian invaders  year terror since  proukrainian part donbass pay war crimes,0,0
1540,2022-10-06T08:50:47.000Z,@elonmusk https://t.co/JgOStaZ5aN,1576994262226702336,0,0,0,,0,Neutral
1541,2022-10-06T08:50:06.000Z,"@elonmusk TeZla new name of your company 

Bad boy Mask",1576994262226702336,0,0,0, tezla new name company bad boy mask,0,1
1542,2022-10-06T08:49:59.000Z,@elonmusk The will of the people who live in Texass &amp; Tennessee should decide wether they're part of the USA or bring back the confederacy.,1576994262226702336,0,0,0, people live texass amp tennessee decide wether theyre part usa bring back confederacy,0,0
1543,2022-10-06T08:49:25.000Z,@elonmusk Maybe then we will ask the inhabitants of Alaska whether they are Russia or the USA? Can we ask the inhabitants of Sakhalin whether they are Russia or Japan? Let's then ask all regions in all countries who they are.,1576994262226702336,0,0,0, maybe ask inhabitants alaska whether russia usa ask inhabitants sakhalin whether russia japan lets ask regions countries are,0,0
1544,2022-10-06T08:49:16.000Z,@elonmusk I suggest you go to the fu**g hell!,1576994262226702336,0,0,0, suggest go fug hell,0,0
1545,2022-10-06T08:48:31.000Z,"@elonmusk Poroshenko is the founder of the Party of Regions, and Zelenskyi has always supported it. Should they be deported to Russia?",1576994262226702336,0,0,1, poroshenko founder party regions zelenskyi always supported it deported russia,0,0
1546,2022-10-06T08:47:52.000Z,"@elonmusk What about all the people who fled the invaders, the people the have killed, the children who were removed from their parents and moved to God knows where in Russia.  Will their votes be counted?  Any concessions to Putin now and he'll just use it to regroup until the next time.",1576994262226702336,0,0,0, people fled invaders people killed children removed parents moved god knows russia votes counted concessions putin hell use regroup next time,0,0
1547,2022-10-06T08:47:46.000Z,@elonmusk How you can offer such advice unless you know the truth? All this situation was directed by Russia in 2014.,1576994262226702336,0,0,0, offer advice unless know truth situation directed russia ,0,0
1548,2022-10-06T08:45:41.000Z,@elonmusk So what kind of “Russian world” do you like?  we don't! https://t.co/FAnbK6p2Ev,1576994262226702336,0,0,5, kind russian world like dont,0,1
1549,2022-10-06T08:44:43.000Z,"@elonmusk Good question but should you ask the same question to other conflict zones seeking independence or separation like Palestine, Kurds and bet even Texas will want to cede  if allowed to have a referendum",1576994262226702336,0,0,0, good question ask question conflict zones seeking independence separation like palestine kurds bet even texas want cede allowed referendum,0,0
1550,2022-10-06T08:44:41.000Z,"@elonmusk Let's rather see on USA 2020 elections. 
Why didn't you suggest to divide USA to Trumpica and Baidenica that time? https://t.co/UKUYDwzsXS",1576994262226702336,0,0,0, lets rather see usa  elections suggest divide usa trumpica baidenica time,0,0
1551,2022-10-06T08:44:30.000Z,@elonmusk I suggest you stick with space stuff and not use your influence like this.,1576994262226702336,0,0,0, suggest stick space stuff use influence like this,0,0
1552,2022-10-06T08:43:39.000Z,"@elonmusk Before any referendum, you have to understand only 1 important thing - a lot of original/local people had to relocate after occupation of Donbas and Crimea.",1576994262226702336,0,0,0, referendum understand  important thing  lot originallocal people relocate occupation donbas crimea,0,0
1553,2022-10-06T08:43:16.000Z,@elonmusk A good idea to avoid war.,1576994262226702336,0,0,0, good idea avoid war,0,0
1554,2022-10-06T08:43:11.000Z,"@elonmusk How about the people of Donbas &amp; Crimea who want to be part of Russia, just fuck off to Russia?",1576994262226702336,0,0,0, people donbas amp crimea want part russia fuck russia,0,0
1555,2022-10-06T08:43:04.000Z,"@elonmusk does it mean people of russia and belarus that don't want to live under dictatorship can also decide to separate peacefully and have their own country? elon, you're such a great diplomat, lol",1576994262226702336,0,0,0, mean people russia belarus want live dictatorship also decide separate peacefully country elon great diplomat lol,1,0
1556,2022-10-06T08:42:49.000Z,@elonmusk How about voting on giving Teslas to people? People will decide,1576994262226702336,0,0,0, voting giving teslas people people decide,0,1
1557,2022-10-06T08:42:26.000Z,@elonmusk Borders are limits. Nationalism creates borders and limits. Humanity does not have borders. Stop losing EVERY single life. There is NO justification to fighting over peaceful negotiation. The one who avoids negotiation for peace carries responsibility for losing lives.,1576994262226702336,0,0,0, borders limits nationalism creates borders limits humanity borders stop losing every single life justification fighting peaceful negotiation one avoids negotiation peace carries responsibility losing lives,0,1
1558,2022-10-06T08:41:57.000Z,@elonmusk what the hell are you doing? Are you sure that the residents of these regions voted?  I'm sure otherwise.  who want to be a part of Russia- a suitcase.  railway station.  Russia.,1576994262226702336,0,0,1, hell doing sure residents regions voted im sure otherwise want part russia suitcase railway station russia,0,0
1559,2022-10-06T08:41:18.000Z,@elonmusk Your opinions about Ukraine it's just ignorance and westplaining or pure stupidity?,1576994262226702336,0,0,0, opinions ukraine ignorance westplaining pure stupidity,0,0
1560,2022-10-06T08:39:31.000Z,"@elonmusk You don't know how Russia propaganda can use this against us at any point, who's crazy from Russia to support an UN foreign vote and their citizens to vote of being left off by russians. Russians came there because they need land, resources, black sea access, Ukraine position...",1576994262226702336,0,1,0, know russia propaganda use us point whos crazy russia support un foreign vote citizens vote left russians russians came need land resources black sea access ukraine position,0,0
1561,2022-10-06T08:38:29.000Z,@elonmusk 👍,1576994262226702336,0,0,0, ,0,Neutral
1562,2022-10-06T08:37:06.000Z,@elonmusk What if Russia decides it's not enough?,1576994262226702336,0,0,0, russia decides enough,0,1
1563,2022-10-06T08:36:37.000Z,"@elonmusk Referral ID
469627195
Referral Link
https://t.co/hZpfovSFxC
=469627195 https://t.co/CoVr57OGKs",1576994262226702336,0,0,0, referral id  referral link,0,1
1564,2022-10-06T08:36:13.000Z,@elonmusk Elon. did you lose your blunt?,1576994262226702336,0,0,0, elon lose blunt,0,0
1565,2022-10-06T08:36:00.000Z,"@elonmusk This is Ukraine , idiot  Musk",1576994262226702336,0,0,0, ukraine  idiot musk,0,0
1566,2022-10-06T08:35:27.000Z,"@elonmusk Hey musky, what happened to the ""putin fyte me 1 v 1 for Ukraine"" take? Now you blowing jobs for big vlad? Gtfo.",1576994262226702336,0,0,6, hey musky happened putin fyte  v  ukraine take blowing jobs big vlad gtfo,0,0
1567,2022-10-06T08:35:18.000Z,"@elonmusk Elon, tell me who told you about Khrushchev and we will definitely know the FSB agent in your environment. The whole world already sees that the RF will never defeat Ukraine, and that the RF is shamefully losing, and you still do not recognize the obvious",1576994262226702336,0,0,0, elon tell told khrushchev definitely know fsb agent environment whole world already sees rf never defeat ukraine rf shamefully losing still recognize obvious,0,0
1568,2022-10-06T08:35:04.000Z,@elonmusk How do you like to suck putins dick ?,1576994262226702336,0,0,0, like suck putins dick ,0,0
1569,2022-10-06T08:35:01.000Z,@elonmusk Don't repeat the mistakes of the past.,1576994262226702336,0,0,0, repeat mistakes past,0,0
1570,2022-10-06T08:34:55.000Z,"@elonmusk You just come up with grounds for the annexation of Ukrainian territories by Putin. In 1938, Neville Chamberlain and Deladier thought that if you give the Czech Republic to Hitler, then there will be no war. But then Hitler captured Poland, France, Belgium, Holland.",1576994262226702336,0,0,0, come grounds annexation ukrainian territories putin  neville chamberlain deladier thought give czech republic hitler war hitler captured poland france belgium holland,0,0
1571,2022-10-06T08:34:33.000Z,@elonmusk isn't suspicious that from 2014 more than half citizens left occupied by RF region? also pls look at occupied regions in Georgia,1576994262226702336,0,0,0, suspicious  half citizens left occupied rf region also pls look occupied regions georgia,0,0
1572,2022-10-06T08:34:21.000Z,"@elonmusk @elonmusk Dear Sir, you are naiive. Please stop playing politics - a game you totally don't understand. You are too important person of this planet not to understand your responsibility about your words and publications. Please do not make a complete fool out of yourself.",1576994262226702336,0,0,0,  dear sir naiive please stop playing politics  game totally understand important person planet understand responsibility words publications please make complete fool yourself,0,0
1573,2022-10-06T08:34:13.000Z,@elonmusk It's a sham referendum Russia controls the votes.,1576994262226702336,0,0,0, sham referendum russia controls votes,0,0
1574,2022-10-06T08:34:12.000Z,"@elonmusk Very stupid, naive, ignorant. The world of technology is not the world of people. It is true that the ""industrial"" magnates are moving towards totalitarianism. Democracy is too complex for them. Technical education and genius are no basis for solving conflicts in human society.",1576994262226702336,0,0,0, stupid naive ignorant world technology world people true industrial magnates moving towards totalitarianism democracy complex them technical education genius basis solving conflicts human society,0,0
1575,2022-10-06T08:33:35.000Z,"@elonmusk Once all opposing Russia have fled or are killed or deported by Russia + the Russian military settles there - it is the best time to let the ""people living there"" decide.",1576994262226702336,0,0,1, opposing russia fled killed deported russia  russian military settles  best time let people living there decide,0,0
