,Unnamed: 0,Author_name,#Followers,Author FollowIndiadiadiag,Account Created,Verified,Location,Tweet,Length,Likes,Language,Retweets,Time,Cleaned,label_predict,py_lib Predictions
1505,2158,DILIPKUMAR9990,2196,538,2014-02-24 14:04:25+00:00,False," Muzaffarpur,  DELHI ,","Brokerage has to be done only for India or brokers have to speak for other countries too!
All the names given below are number one of all these brokerages!
 @UN_Women , @Malala , @miakhalifa , @rihanna
 #Poland
 #StandWithUkraine  #RussiaUkraineWar https://t.co/kanH5tgGtK","[0, 248]",1,en,0,2022-03-26 18:31:56+00:00,brokerage done india brokers speak countries names given number one brokerages poland standwithukraine russiaukrainewar,0,0
1506,2159,TeamShakeri,1520,175,2014-04-19 12:28:19+00:00,False,Toronto,"RT @PJavi14: https://t.co/3JzRJCkrAi 
#Putin #PutinWarCriminal #PutinHitler #PutinAsesino #PutinIsaWarCriminal #PutinsWarCrimes #PutinsWar…","[0, 139]",0,und,1,2022-03-26 18:31:50+00:00,nan,0,0
1507,2160,PopeOfLoveComic,28,213,2013-04-16 13:51:18+00:00,False,,Tulsi Gababard's Sketchy Connections To Russian Money https://t.co/gN4gkCeN7Z via @YouTube #GOPTraitorsToDemocracy #RussiaUkraineWar #FoxNews @TulsiGabbard has always hated America. She just follows the money. She was never a democrat and has always been an enemy agent.,"[0, 270]",0,en,0,2022-03-26 18:31:47+00:00,tulsi gababards sketchy connections russian money,0,0
1508,2164,zasambhu,1176,2169,2013-12-06 02:17:17+00:00,False,"भारत, INDIA","RT @www3update1: 🚨🚨🚨#BREAKING : 6 Russian hypersonic missiles hit the Ukrainian capital #Kyiv and city #Lviv just while ago.

#UkraineRussi…","[0, 140]",0,en,1,2022-03-26 18:31:35+00:00,breaking russian hypersonic missiles hit ukrainian capital kyiv city lviv ago ukrainerussi,0,0
1509,2165,kowalamedia,22,53,2020-04-06 18:54:32+00:00,False,Minneapolis/MN ,"Well, that escalated quickly...
#Potus declares #RegimeChange 
After #RussiaUkraineWar 
#MediaFreeAmerica https://t.co/tqXHjheGwi","[0, 105]",2,en,0,2022-03-26 18:31:23+00:00,well escalated quickly potus declares regimechange russiaukrainewar mediafreeamerica,0,1
1510,2166,AhoraNewsAhora,463,43,2019-05-06 16:17:15+00:00,False,,"Nuevas explosiones en #Lviv
#UcraniaRusia #RussiaUkraineWar #RussiaUkraineConflict https://t.co/FNjTY8CuZm","[0, 82]",0,es,0,2022-03-26 18:31:14+00:00,nuevas explosiones en lviv ucraniarusia russiaukrainewar russiaukraineconflict,0,0
1511,2168,SuperHiroMikey,171,988,2009-05-23 13:32:00+00:00,False,"London, UK","By the way @RishiSunak, are you not ashamed that your family benefit from a company that continues to operate in Russia? #RishiSunak #OneRuleForThem #RussiaUkraineWar https://t.co/TyKyBZIWTH","[0, 166]",1,en,1,2022-03-26 18:31:04+00:00,way ashamed family benefit company continues operate russia rishisunak oneruleforthem russiaukrainewar,0,0
1512,2169,djosed77,28,203,2022-01-30 00:29:56+00:00,False,,"RT @Qr3141: Russia released a footage of a Russian ship opening fire with Kalibr cruise missiles toward Ukraine

#Ukraine #Russia #Breaking…","[0, 140]",0,en,1,2022-03-26 18:30:49+00:00,russia released footage russian ship opening fire kalibr cruise missiles toward ukraine ukraine russia breaking,0,0
1513,2170,zasambhu,1176,2169,2013-12-06 02:17:17+00:00,False,"भारत, INDIA","RT @www3update1: 🚨 Russian Strikes reported close to the polish border.

Biden is still in Poland.

#Kyiv #Kiev #RussiaUkraineWar #Rusia #U…","[0, 140]",0,en,1,2022-03-26 18:30:42+00:00,russian strikes reported close polish border biden still poland kyiv kiev russiaukrainewar rusia u,0,0
1514,2171,JoshJJ23,140,322,2014-03-14 04:59:44+00:00,False,Canada,"#Biden will start #WWIII before #Putin does

Biden has dementia and can not think right. This is a dangerous situation

#RussiaUkraineWar #BidenIsAFailure #EU #Ukraine https://t.co/GZezrJ5PcU","[0, 167]",0,en,0,2022-03-26 18:30:26+00:00,biden start wwiii putin biden dementia think right dangerous situation russiaukrainewar bidenisafailure eu ukraine,0,0
1515,2172,saada186,759,2433,2012-11-12 04:18:12+00:00,False,Islamabad,"#NewsUpdate 

#Biden declares #Putin 'cannot remain in power' in fiery #Warsaw remarks  
#pakustv #NYC #politics #RussiaUkraineWar #kyiv #Moscow #WashingtonDC 
https://t.co/AnZFAswKeU","[0, 183]",0,en,0,2022-03-26 18:30:24+00:00,newsupdate biden declares putin cannot remain power fiery warsaw remarks pakustv nyc politics russiaukrainewar kyiv moscow washingtondc,0,0
1516,2173,KerberosNews,746,1078,2020-06-24 04:16:53+00:00,False,"Delaware, USA",'This Is A Defensive War Against NATO's Eastward Expansion' :John Wight Projects Kremlin’s POV #Russian #RussiaUkraineWar #NATO #Biden #NaziUkraine #Nazi #USA https://t.co/SaDKWwy4J5 via @YouTube,"[0, 195]",0,en,0,2022-03-26 18:30:13+00:00,defensive war natos eastward expansion john wight projects kremlins pov russian russiaukrainewar nato biden naziukraine nazi usa,0,0
1517,2174,SaraAGiussani,1128,325,2015-11-22 13:58:15+00:00,False,,"I hope NATO members will abandon the idea of adopting a first-nuclear-strike strategy. I think it's a high-risk strategy with dangerous consequences for the whole world.
#RussiaUkraineWar #nuclear #g7 #NATOSummit #USA #Europe #Brussels #saragiusaani","[0, 249]",1,en,0,2022-03-26 18:30:02+00:00,hope nato members abandon idea adopting firstnuclearstrike strategy think highrisk strategy dangerous consequences whole world russiaukrainewar nuclear g natosummit usa europe brussels saragiusaani,0,0
1518,2176,NotesIll,36,79,2021-05-26 14:49:37+00:00,False,Western NY,@POTUS I still think we should wipe out the bulk of the #RussianMilitary before they dig in. #Putin would be dead and gone before he could rebuild it to use it again. #RussiaUkraineWar #PutinsWar,"[7, 195]",0,en,0,2022-03-26 18:29:54+00:00,still think wipe bulk russianmilitary dig putin would dead gone could rebuild use russiaukrainewar putinswar,0,0
1519,2177,Argillano,311,283,2013-01-19 19:05:02+00:00,False,Latium vetus,RT @EuromaidanPR: Biden: US will allocate 1 billion $ for humanitarian aid for Ukraine | EMPR #RussiaUkraineWar,"[0, 111]",0,en,27,2022-03-26 18:29:35+00:00,biden us allocate billion humanitarian aid ukraine empr russiaukrainewar,0,0
1520,2179,naser13606915,2132,919,2021-03-05 10:33:37+00:00,False,,"IT BEGAN WITH A LIE 
(German documentary (ENG SUBS) about the bombing of Yugoslavia in 1999)
#Biden #Ukraine #RussiaUkraineWar #Serbia #Putin #Russian 
https://t.co/4hv8f1zXA7","[0, 175]",0,en,1,2022-03-26 18:29:04+00:00,began lie german documentary eng subs bombing yugoslavia biden ukraine russiaukrainewar serbia putin russian,0,0
1521,2180,MawunyegaKojo,509,5000,2019-06-22 15:38:48+00:00,False,,"RT @EidMworia: A warm welcome. 
#Russian #RussiaUkraineWar #Kyiv #Poland #America #Lviv https://t.co/ur6FU8TDb3","[0, 111]",0,en,1,2022-03-26 18:28:50+00:00,warm welcome russian russiaukrainewar kyiv poland america lviv,1,1
1522,2181,infounderradar,52,131,2021-02-17 21:53:59+00:00,False,,#costofwar #RussianUkrainianWar #russiavsukraine #RussiaUkraineWar #Russian #UkraineWar #war #PeaceInUkraine #UkraineUnderAttaсk  #podcast #RussiaUkraineConflict,"[0, 161]",0,und,0,2022-03-26 18:28:39+00:00,costofwar russianukrainianwar russiavsukraine russiaukrainewar russian ukrainewar war peaceinukraine ukraineunderattak podcast russiaukraineconflict,0,0
1523,2182,MatchaMargar3ta,3,1,2018-01-16 03:01:56+00:00,False,USA,Zelensky starting to look like the boy who cried wolf #RussiaUkraineWar #RussiaUkraineConflict #UkraineUnderAttaсk,"[0, 114]",0,en,0,2022-03-26 18:28:39+00:00,zelensky starting look like boy cried wolf russiaukrainewar russiaukraineconflict ukraineunderattak,0,0
1524,2183,MawunyegaKojo,509,5000,2019-06-22 15:38:48+00:00,False,,"RT @WorldAtWarRuss1: Arrivals of ""Caliber"" in the Nikolaev region. The local Volkssturm is especially funny, trying to shoot them down with…","[0, 140]",0,en,1,2022-03-26 18:28:35+00:00,arrivals caliber nikolaev region local volkssturm especially funny trying shoot,1,1
1525,2184,djosed77,28,203,2022-01-30 00:29:56+00:00,False,,"RT @Inglorious_Jay: Ukrainian prisoners in the #Kiev region.

#truthbetold #RussiaUkraineWar https://t.co/zUpnJ4TXJB","[0, 116]",0,en,6,2022-03-26 18:28:10+00:00,ukrainian prisoners kiev region truthbetold russiaukrainewar,0,0
1526,2185,TopFeaturedcom,8033,7636,2014-07-30 21:11:02+00:00,False,Top Featured Content: GO 👉,"Breaking - Reported: #Biden says #Putin 'cannot remain in #power' in sweeping #speech on #Russian #invasion of Ukraine more https://t.co/iVeEiHAiGF

#ukraine #nuclear #russia #war #UkraineRussia #RussiaUkraineWar #nato #europe #RussiaUkraineConflict #News
https://t.co/Ec4LnIv4uW","[0, 279]",0,en,0,2022-03-26 18:27:49+00:00,breaking reported biden says putin cannot remain power sweeping speech russian invasion ukraine,0,0
1527,2186,possibility_new,76,283,2016-02-02 04:52:35+00:00,False,,"#RussiaUkraineWar #Russian #Biden 
You can easily spot the propagandist nature of the numbers by examining their wide margin of error. It simply shows they are ignorant of the tally, hence not in control in #Ukraine ... https://t.co/jY1rYMdaxR","[0, 219]",0,en,0,2022-03-26 18:27:44+00:00,russiaukrainewar russian biden easily spot propagandist nature numbers examining wide margin error simply shows ignorant tally hence control ukraine,0,0
1528,2187,bullitt162729,29,351,2022-02-18 21:15:07+00:00,False,aaconsult1627@gmail.com,@GOPLeader Doing a fine job of this already and of taking out the competition in the process. #NaturalGas #Europe Big Deal. Policy direction is blatantly obvious behind #RussiaUkraineWar.  #Stop fanning the fire to a massive #Global #ECONOMIC COLLAPSE to line #AMERICAN #corporate pockets,"[11, 288]",0,en,0,2022-03-26 18:27:34+00:00,fine job already taking competition process naturalgas europe big deal policy direction blatantly obvious behind russiaukrainewar stop fanning fire massive global economic collapse line american corporate pockets,0,0
1529,2189,RomanM72223110,23,393,2018-09-06 06:22:29+00:00,False,Ukraine,"💙💛Love is ...
Watch together as a Russian warship burns in #Berdyansk.
#StandWithUkraine #StopPutin #StopWarInUkraine #StopRussianAggression #RussiaUkraineWar https://t.co/rEcZDv3Js4","[0, 158]",0,en,0,2022-03-26 18:27:23+00:00,love watch together russian warship burns berdyansk standwithukraine stopputin stopwarinukraine stoprussianaggression russiaukrainewar,1,1
1530,2190,IU_embassy,472,63,2018-02-18 15:51:54+00:00,False,Kazan,"Criminal liability was introduced on the territory of 🇷🇺 for demonstrations with anti-war appeals. Totalitarian country.
#RussiaDisintegration
#RussiaUkraineWar https://t.co/E1A2zrjCG3","[0, 160]",10,en,4,2022-03-26 18:27:22+00:00,criminal liability introduced territory demonstrations antiwar appeals totalitarian country russiadisintegration russiaukrainewar,0,0
1531,2191,MattLCapon,2134,2064,2015-11-05 00:14:24+00:00,False,"London, England","RT @JasonNParkinson: ODESA, UKRAINE – MARCH 26: Volunteers take part in weapons training at a non-disclosed location on March 26, 2022 in #…","[0, 140]",0,en,1,2022-03-26 18:27:19+00:00,odesa ukraine march volunteers take part weapons training nondisclosed location march,0,1
1532,2193,ahlswedecollect,37,575,2022-01-24 19:37:18+00:00,False,"Chico, California","It’s been clear from the beginning what needs to happen.

Russian citizens need to remove #Putin from power - somehow, some way.

He is a war criminal. He is sending Russians to die.

#PutinWarCrimes #StopPutin #Russia #RussiaUkraineWar #RussianUkrainianWar #RussiaUkraineConflict https://t.co/vrFV7rqrj2","[0, 280]",1,en,1,2022-03-26 18:27:10+00:00,clear beginning needs happen russian citizens need remove putin power somehow way war criminal sending russians die putinwarcrimes stopputin russia russiaukrainewar russianukrainianwar russiaukraineconflict,0,0
1533,2197,hisoka_lord,15,11,2018-05-24 19:18:49+00:00,False,Ukraine,"❗️This is the pride of the #Russian  defense industry armored car ""Lynx"" before and after the meeting with the #Ukrainian  military 💪🇺🇦

#Ukraine #UkraineUnderAttaсk #RussianWarCrimes #Putin #RussiaUkraineWar https://t.co/Hvcih9i3FD","[0, 208]",4,en,1,2022-03-26 18:26:26+00:00,pride russian defense industry armored car lynx meeting ukrainian military ukraine ukraineunderattak russianwarcrimes putin russiaukrainewar,0,1
1534,2198,JasonNParkinson,2083,493,2009-08-31 09:21:07+00:00,False,London,"ODESA, UKRAINE – MARCH 26: Volunteers take part in weapons training at a non-disclosed location on March 26, 2022 in #Odesa, Ukraine. ©JASONN.PARKINSON #RussiaUkraineWar https://t.co/P1agTUdH4q","[0, 169]",2,en,1,2022-03-26 18:26:09+00:00,odesa ukraine march volunteers take part weapons training nondisclosed location march odesa ukraine jasonnparkinson russiaukrainewar,0,1
1535,2199,tVoiceOfCitizen,407,114,2017-07-08 13:05:08+00:00,False,"Mumbai, India",Forces of the US to join #RussiaUkraineWar against #RussianArmy that's what Joe Biden #POTUS is hunting at 🤔 https://t.co/Jt3K7PrKdg,"[0, 108]",0,en,2,2022-03-26 18:26:01+00:00,forces us join russiaukrainewar russianarmy thats joe biden potus hunting,0,0
1536,2200,BruceBourgoine,48464,43950,2012-03-02 20:27:50+00:00,False,Maine,"Methinks this is pretty much the last war with tanks playing any significant role.

#RussiaUkraineWar https://t.co/98uMKiKatY","[0, 101]",15,en,3,2022-03-26 18:25:55+00:00,methinks pretty much last war tanks playing significant role russiaukrainewar,0,1
1537,2202,Mrtradescrypto,212,329,2017-10-26 23:10:54+00:00,False,United Kingdom,"Buckle up guys, thing will get a whole lot worse 👀 

#RussiaUkraineWar #TheGreatReset #Dedollarization #supplychainissues 
#blockchain #Crypto #XRP #XDC https://t.co/qZ88UYKskt","[0, 152]",4,en,2,2022-03-26 18:25:36+00:00,buckle guys thing get whole lot worse russiaukrainewar thegreatreset dedollarization supplychainissues blockchain crypto xrp xdc,0,0
1538,2203,MiEpitafio,55,64,2011-02-03 20:05:19+00:00,False,,"He, @AbeShinzo, has also written and recited a poem stating he and #Putin are soul mates and yarn for the same dream. Yet, he refuses to talk to #Putin to ask him to stop #RussiaUkraineWar. https://t.co/L6hd6x4pzJ","[0, 189]",0,en,0,2022-03-26 18:25:24+00:00,also written recited poem stating putin soul mates yarn dream yet refuses talk putin ask stop russiaukrainewar,0,0
1539,2205,Argillano,311,283,2013-01-19 19:05:02+00:00,False,Latium vetus,"RT @EuromaidanPR: BREAKING Russian missile hit Lviv, city mayor Sadovuy reports | EMPR #RussiaUkraineWar #StopWar","[0, 113]",0,en,31,2022-03-26 18:25:21+00:00,breaking russian missile hit lviv city mayor sadovuy reports empr russiaukrainewar stopwar,0,0
1540,2208,kyle_iridian,81,1122,2021-10-29 04:53:15+00:00,False,,RT @WIONews: #WIONExclusive | Hope this unjustified war started by Russia ends soon. Putin needs to restore territorial integrity: Estonian…,"[0, 140]",0,en,4,2022-03-26 18:25:11+00:00,wionexclusive hope unjustified war started russia ends soon putin needs restore territorial integrity estonian,1,0
1541,2209,WIONews,437873,99,2016-03-21 03:44:54+00:00,True,India,"Russia putting their nuclear power on alert is a message to the West and not to Ukraine: Russian affairs expert @fredweir3 tells @alysonle 

#RussiaUkraineWar

Watch more: https://t.co/dm7SyBIpO6 https://t.co/pZ2J8vkOy3","[0, 195]",34,en,11,2022-03-26 18:24:53+00:00,russia putting nuclear power alert message west ukraine russian affairs expe tells russiaukrainewar watch,0,0
1542,2210,WorldAtWarRuss1,156,22,2022-02-25 21:54:43+00:00,False,,"Arrivals of ""Caliber"" in the Nikolaev region. The local Volkssturm is especially funny, trying to shoot them down with small arms

#Kyiv
#RussiaUkraineWar 
#RussiaUkraineConflict 
#Russia
#Ukraine https://t.co/9SLuzT6ive","[0, 196]",2,en,1,2022-03-26 18:24:49+00:00,arrivals caliber nikolaev region local volkssturm especially funny trying shoot small arms kyiv russiaukrainewar russiaukraineconflict russia ukraine,0,1
1543,2211,MahendraAmbulg2,25,42,2020-06-26 06:48:42+00:00,False,"Nanded, India","RT @VIPs_Finstock: Russia may accept bitcoin as a payment method for oil purchases, but only from friendly countries.
#Bitcoin #Russia #Rus…","[0, 140]",0,en,6,2022-03-26 18:24:38+00:00,russia may accept bitcoin payment method oil purchases friendly countries bitcoin russia rus,0,0
1544,2212,EidMworia,708,682,2021-01-14 13:21:19+00:00,False,"Samara, Russia","A warm welcome. 
#Russian #RussiaUkraineWar #Kyiv #Poland #America #Lviv https://t.co/ur6FU8TDb3","[0, 72]",4,en,1,2022-03-26 18:23:59+00:00,warm welcome russian russiaukrainewar kyiv poland america lviv,1,1
1545,2213,zasambhu,1176,2169,2013-12-06 02:17:17+00:00,False,"भारत, INDIA","RT @www3update1: ❗️This is how the cruise missile flew over #Kiev
#USA
#RussiaUkraineWar
#Rusia
#Ukrainian
#Ukraine #Russia #TPYXA https://…","[0, 140]",0,en,1,2022-03-26 18:23:36+00:00,cruise missile flew kiev usa russiaukrainewar rusia ukrainian ukraine russia tpyxa,0,0
1546,2214,youth4bjp,8097,1016,2010-05-24 03:51:27+00:00,False,Delhi,"RT @ShailendraDhar: Biden says NATO's territory, NATO is not a country. Nations have territory. NATO is a treaty not a nation.
Reveals what…","[0, 140]",0,en,1,2022-03-26 18:23:16+00:00,biden says natos territory nato country nations territory nato treaty nation reveals,0,0
1547,2217,In_AnkitSingla,626,5000,2014-03-29 05:23:59+00:00,False,India,"RT @IndiaToday: Amid the raging war, several universities have separate guidelines for students studying in border regions of Ukraine. @Gee…","[0, 140]",0,en,7,2022-03-26 18:23:09+00:00,amid raging war several universities separate guidelines students studying border regions ukraine,0,0
1548,2220,possibility_new,76,283,2016-02-02 04:52:35+00:00,False,,"#RussiaUkraineWar #Russian #Biden 
Please get informed about the conflict by ignoring ALL American networks and sources. European networks are light years better.

Both the beleaguered Ukrainian government and NATO news releases about Russian casualities are obviously propaganda.","[0, 280]",0,en,0,2022-03-26 18:22:30+00:00,russiaukrainewar russian biden please get informed conflict ignoring american networks sources european networks light years better beleaguered ukrainian government nato news releases russian casualities obviously propaganda,0,0
1549,2221,RomanM72223110,23,393,2018-09-06 06:22:29+00:00,False,Ukraine,"Once upon a time, this was a russian tank T-80
But something went wrong and Ukrainian forces disassembled it ti investigate the issue. 
#StandWithUkraine #UkrainianArmy #StopWarInUkraine #RussiaUkraineWar https://t.co/ql3e1BaQET","[0, 204]",0,en,0,2022-03-26 18:22:14+00:00,upon time russian tank something went wrong ukrainian forces disassembled ti investigate issue standwithukraine ukrainianarmy stopwarinukraine russiaukrainewar,0,0
1550,2222,RenKeNews,48943,401,2009-11-20 19:45:04+00:00,False,"Brussels, Belgium","Lviv in western #Ukraine under Russian missile attack, from my friend. #RussiaUkraineWar https://t.co/un8ROasctX","[0, 88]",4,en,3,2022-03-26 18:22:10+00:00,lviv western ukraine russian missile attack friend russiaukrainewar,0,1
1551,2225,SaraAGiussani,1128,325,2015-11-22 13:58:15+00:00,False,,"The USA 🇺🇸 and the European Union 🇪🇺 have announced a new partnership to reduce Europe's dependence on Russian energy. Now more than ever unity is the real strength.
#RussiaUkraineWar #gas #USA #Europe #Biden #StopWarInUkraine #Peace #saragiussani","[0, 257]",2,en,0,2022-03-26 18:21:48+00:00,usa european union announced new partnership reduce europes dependence russian energy ever unity real strength russiaukrainewar gas usa europe biden stopwarinukraine peace saragiussani,0,1
1552,2226,Im_Just_Saying4,229,536,2012-09-05 15:05:50+00:00,False,,I pray for the Creator to kill #Putin in the Name of Nature's Ruler! #Ukraine #UkraineUnderAttaсk #UkraineRussianWar #RussiaUkraineWar #RussianYouth #RussianProtestors Would the #Russian assault and decimation of civilian people happen if #VladmirPutin were dead? A big Hail stone https://t.co/lyXZpEWqpl,"[0, 280]",0,en,1,2022-03-26 18:21:33+00:00,pray creator kill putin name natures ruler ukraine ukraineunderattak ukrainerussianwar russiaukrainewar russianyouth russianprotestors would russian assault decimation civilian people happen vladmirputin dead big hail stone,0,0
1553,2227,WorldAtWarRuss1,156,22,2022-02-25 21:54:43+00:00,False,,"As a result of new missile strikes on #Lviv, significant damage was caused to infrastructure facilities. Residential buildings were not damaged. Firefighting continues

#Kyiv
#Ukraine 
#RussiaUkraineWar 
#RussiaUkraineConflict 
#Russia https://t.co/lELZbeJbEH","[0, 235]",1,en,1,2022-03-26 18:21:32+00:00,result new missile strikes lviv significant damage caused infrastructure facilities residential buildings damaged firefighting continues kyiv ukraine russiaukrainewar russiaukraineconflict russia,0,0
1554,2228,Argillano,311,283,2013-01-19 19:05:02+00:00,False,Latium vetus,RT @EuromaidanPR: Chernobyl satellite city of Slavutych avoids the Russian blockade: new updates | EMPR https://t.co/lPsJs6Pczp #RussiaUkra…,"[0, 140]",0,en,18,2022-03-26 18:21:31+00:00,chernobyl satellite city slavutych avoids russian blockade new updates empr,0,0
1555,2229,zasambhu,1176,2169,2013-12-06 02:17:17+00:00,False,"भारत, INDIA","RT @GeoffreyLake1: Russia demanding Europe pay for gas in rubles could have huge repercussions, by #RussiaUkraineWar #petrodollar @Benjamin…","[0, 140]",0,en,1,2022-03-26 18:21:21+00:00,russia demanding europe pay gas rubles could huge repercussions russiaukrainewar petrodollar,0,0
1556,2230,minnie_mall,561,1695,2021-01-02 01:48:28+00:00,False,,"NOW DO YOU SEE? THIS IS WORLD WAR III… THE END GAME WAR

https://t.co/EN2gzC0Evb

#Ukraine #Russia #RussiaUkraineWar #Donbass #Donbas #Kiev #Kyiv #Donetsk #Lugansk #Luhansk #Russian #Victory #RussianDemands #SpecialOperation #KievJunta #KievRegime #Compliance #Geopolitics #WWIII https://t.co/U3j4T7KyYu","[0, 279]",4,en,3,2022-03-26 18:21:11+00:00,see world war iii end game war,0,1
1557,2231,Srbgaaysel,187,640,2021-10-23 09:47:32+00:00,False,,"RT @Alparslanicin: @smaalparslansar Let's be the hero of Alparslan baby together. I am here for you honey🙋🏻‍♀️
https://t.co/d1gGq43G2L

#Br…","[0, 140]",0,en,5,2022-03-26 18:21:08+00:00,lets hero alparslan baby together honey,1,1
1558,2234,dneha77,212,258,2010-03-02 09:08:25+00:00,False,Mumbai,"RT @timesofindia: Putin has failed to divide #Nato, says Biden in #Poland

#RussiaUkraineWar live updates: 
 https://t.co/aYt8dKOgJW https:…","[0, 140]",0,en,6,2022-03-26 18:20:43+00:00,putin failed divide nato says biden poland russiaukrainewar live updates,0,0
1559,2235,Kseniatajjna,65,15,2011-11-14 14:33:21+00:00,False,"Ukraine, Krivoy Rog","Russia/ #Putin is not goin to stop in Ukrain!!! Russian TV 
#Ukraine #Russian #RussiaUkraineWar #StopPutin #StandWithUkraine #StopRussianAggression #StopWar #USA #Europe #PutinHitler #StopRussiaNOW #UkraineWar Poland https://t.co/sxIrWhpplv","[0, 216]",1,en,1,2022-03-26 18:20:14+00:00,russia putin goin stop ukrain russian tv ukraine russian russiaukrainewar stopputin standwithukraine stoprussianaggression stopwar usa europe putinhitler stoprussianow ukrainewar poland,0,0
1560,2237,gammaflip,125,1880,2019-09-23 21:19:15+00:00,False,,"@ianbremmer Any analyst worth his salt can trace the cause of the #RussiaUkraineWar to the #Biden administration engineering the ‘U.S.-Ukraine Charter on Strategic Partnership’, which is nothing less than a blueprint for fast tracking Ukraine’s entry into #NATO.","[12, 262]",2,en,1,2022-03-26 18:19:55+00:00,analyst worth salt trace cause russiaukrainewar biden administration engineering usukraine charter strategic partnership nothing less blueprint fast tracking ukraines entry nato,0,1
1561,2238,Xycocb,424,2971,2008-10-24 18:03:32+00:00,False,"Lisboa, Portugal",@biannagolodryga @mashagessen that request from #JoeBiden is going to escalate the #russiaukrainewar . It´s up to the russian people to decide the future of #Putin regime.,"[30, 171]",0,en,0,2022-03-26 18:19:49+00:00,request joebiden going escalate russiaukrainewar russian people decide future putin regime,0,0
1562,2240,Argillano,311,283,2013-01-19 19:05:02+00:00,False,Latium vetus,"RT @EuromaidanPR: #Russia hit Lysychansk with the Tochka-U ballistic missile, several houses are burning in Severodonetsk, reports Serhiy H…","[0, 140]",0,en,20,2022-03-26 18:19:39+00:00,russia hit lysychansk tochkau ballistic missile several houses burning severodonetsk reports serhiy h,0,0
1563,2241,hisoka_lord,15,11,2018-05-24 19:18:49+00:00,False,Ukraine,"❗️The #Russian  occupiers again hit residential buildings with heavy artillery.

#Ukraine #UkraineUnderAttaсk #RussiaUkraineWar #UkraineRussie #Putin https://t.co/XDutyCx1Me","[0, 149]",0,en,0,2022-03-26 18:19:33+00:00,russian occupiers hit residential buildings heavy artillery ukraine ukraineunderattak russiaukrainewar ukrainerussie putin,0,0
1564,2242,Internl_Leaks,4640,0,2021-02-16 20:04:26+00:00,False,World,"Captured tank near #Sumy east Ukraine 

#UkraineWar #UkraineUnderAttaсk #Ukraine️ #UkraineRussia #Russian #RussiaUkraineWar #RussiaUkraineConflict #RussianUkrainianWar #RussianArmy https://t.co/XOlwPgrF1v","[0, 180]",1,en,1,2022-03-26 18:19:18+00:00,captured tank near sumy east ukraine ukrainewar ukraineunderattak ukraine ukrainerussia russian russiaukrainewar russiaukraineconflict russianukrainianwar russianarmy,0,0
1565,2243,DIREKOr,1207,1067,2014-06-18 20:14:17+00:00,False,,RT @iamavikjordan: The deputy chief of staff of the Ukrainian 503 separate battalion of marines tried to leave Mariupol and was caught be R…,"[0, 140]",0,en,14,2022-03-26 18:19:16+00:00,deputy chief staff ukrainian separate battalion marines tried leave mariupol caught r,0,0
