,Unnamed: 0,Author_name,#Followers,Author FollowIndiadiadiag,Account Created,Verified,Location,Tweet,Length,Likes,Language,Retweets,Time,Cleaned,label_predict,py_lib Predictions
1009,1412,vikashvermabjp,943,1204,2016-09-25 17:50:09+00:00,False,"India, India","RT @WIONews: #StraightTalk | When Indian students were stranded in Ukraine, Minister Jaishankar reached out to me, asked if we could help.…","[0, 139]",0,en,84,2022-03-26 22:05:28+00:00,straighttalk indian students stranded ukraine minister jaishankar reached asked could help,0,0
1010,1414,TimesNow,10222943,375,2011-01-20 12:17:23+00:00,True,India,"Ukraine-Russia Conflict: Rockets hit Lviv in western Ukrainian city of Lviv

#RussiaUkraineWar

https://t.co/aWJSWeuBNw","[0, 119]",1,en,0,2022-03-26 22:05:00+00:00,ukrainerussia conflict rockets hit lviv western ukrainian city lviv russiaukrainewar,0,0
1011,1416,vanessa_p_831,1508,970,2016-06-02 19:56:43+00:00,False,Fuck Capitalism,RT @hugoturner1969: Anti- Imperialist U: The Russia-Ukraine War https://t.co/K37TDeuO0j #Russia #Ukraine #NATO #RussiaUkraineWar https://t.…,"[0, 140]",0,en,2,2022-03-26 22:04:55+00:00,anti imperialist u russiaukraine war,0,0
1012,1417,ukrainetalk,33,123,2019-04-06 13:07:37+00:00,False,Ukraine,#Ukrainianarmy destroyed many #russian occupiers and liberated the village from russian occupation #Ukraine #UkraineWar #UkraineUnderAttaсk #warukraine #news #StandWithUkraine #RussiaUkraine #WARINUKRAINE #RussiaUkraineWar #UkraineRussiaWar  #RussiaInvadedUkraine #stoprussia https://t.co/DJxyCDtIuB,"[0, 275]",1,en,1,2022-03-26 22:04:54+00:00,ukrainianarmy destroyed many russian occupiers liberated village russian occupation ukraine ukrainewar ukraineunderattak warukraine news standwithukraine russiaukraine warinukraine russiaukrainewar ukrainerussiawar russiainvadedukraine stoprussia,0,0
1013,1420,OleSpan,295,1101,2012-04-20 20:56:21+00:00,False,Україна,"#RussiaUkraineWar

Captive occupiers. https://t.co/0AWK0R7FUn","[0, 37]",1,en,2,2022-03-26 22:04:29+00:00,russiaukrainewar captive occupiers,0,0
1014,1421,AnnaMazur1010,5,19,2022-03-18 14:32:37+00:00,False,,#Russia organized a real genocide in #Mariupol. There are so many killed civilians that they're not buried in cemeteries but directly in the yards of bombed houses. It's terrible! #RussiaUkraineWar #RussiaInvadesUkraine #StandWithUkraine #WARINUKRAINE https://t.co/X9DQmdIo0H,"[0, 251]",3,en,0,2022-03-26 22:04:09+00:00,russia organized real genocide mariupol many killed civilians theyre buried cemeteries directly yards bombed houses terrible russiaukrainewar russiainvadesukraine standwithukraine warinukraine,0,0
1015,1423,DenisRogatyuk,10946,1702,2012-03-16 03:22:33+00:00,False,Chile,"By promoting a US-led regime change operation, Biden has just given Putin all the ammunition he needed to completely purge the pro-western political organisations and oligarchs who would be suspected of supporting such an operation. 
#RussiaUkraineWar 

https://t.co/AWFOrmwsod","[0, 277]",14,en,11,2022-03-26 22:03:52+00:00,promoting usled regime change operation biden given putin ammunition needed completely purge prowestern political organisations oligarchs would suspected supporting operation russiaukrainewar,0,0
1016,1426,JAlan21813286,71,105,2021-03-11 22:32:25+00:00,False,,The Scattering Russians fleeing Russia #RussiaUkraineWar https://t.co/vKikEMZk2A,"[0, 80]",0,en,0,2022-03-26 22:03:34+00:00,scattering russians fleeing russia russiaukrainewar,0,0
1017,1427,woptimus1967,33,63,2018-06-10 21:15:29+00:00,False,"Ontario, Canada","RT @frank_fremer: This is the wife of the Vice President of Ukraine. She is fighting for her Motherland. Massive Respect. 🙌🇺🇦

#RussiaUkrai…","[0, 140]",0,en,892,2022-03-26 22:03:27+00:00,wife vice president ukraine fighting motherland massive respect russiaukrai,0,1
1018,1428,ganeshbabuab,208,1415,2011-02-01 15:49:21+00:00,False,"London, England","RT @IndiaToday: Putin has signalled multiple times that he is not in favour of NATO’s expansion. While NATO has been expanding, #Russia has…","[0, 140]",0,en,7,2022-03-26 22:02:29+00:00,putin signalled multiple times favour natos expansion nato expanding russia,0,0
1019,1430,Alessia85287395,3,56,2022-03-01 23:25:17+00:00,False,,"RT @KatySec: Leader of Azov battalion in Mariupol among Ukrainian fighters captured by pro-Russian forces.

#RussiaUkraineWar #RussiaUkrain…","[0, 140]",0,en,7,2022-03-26 22:01:40+00:00,leader azov battalion mariupol among ukrainian fighters captured prorussian forces russiaukrainewar russiaukrain,0,0
1020,1431,Speakwrespect,104,332,2021-08-15 14:24:01+00:00,False,USA,"Millions of #Democrats feel the same way as the author of the piece below. 
#Ukraine #RussiaUkraineWar #airdefence 
@POTUS @TheDemocrats @WhiteHouse @SenateDems @HouseDemocrats https://t.co/q0rqTU5wGJ","[0, 176]",1,en,1,2022-03-26 22:01:21+00:00,millions democrats feel way author piece ukraine russiaukrainewar airdefence,0,0
1021,1434,OleSpan,295,1101,2012-04-20 20:56:21+00:00,False,Україна,"#RussiaUkraineWar

Lviv today.  A strike by Russian missiles. https://t.co/Y0OboPiW1t","[0, 61]",0,en,0,2022-03-26 22:00:52+00:00,russiaukrainewar lviv today strike russian missiles,0,0
1022,1437,ClaudiaKellyB,837,405,2009-08-08 05:28:25+00:00,False,"Atlanta, GA","RT @Jeff_Paul: The mayor of Lviv says he thinks that with today's strikes, the aggressor wants to say hello to President Biden who is curre…","[0, 140]",0,en,4,2022-03-26 22:00:14+00:00,mayor lviv says thinks todays strikes aggressor wants say hello president biden curre,0,1
1023,1438,PillarVonSen,6,79,2021-12-04 13:50:12+00:00,False,,RT @ZOONewsTV: Russian soldiers captured by Ukrainian troops in Sumy #Ukraine️ #Russia #UkraineRussiaWar #RussiaUkraineWar https://t.co/wCp…,"[0, 140]",0,en,20,2022-03-26 22:00:11+00:00,russian soldiers captured ukrainian troops sumy ukraine russia ukrainerussiawar russiaukrainewar,0,0
1024,1439,AnnaMazur1010,5,19,2022-03-18 14:32:37+00:00,False,,The consequences of shelling in #Mariupol. #Russia is literally erasing this Ukrainian city from the face of the earth. Thousands of civilians were killed. Buildings were completely destroyed. That’s what #Putin brought to this city. #PutinWarCriminal #war #RussiaUkraineWar https://t.co/FCtrSZVl0Y,"[0, 274]",0,en,1,2022-03-26 22:00:09+00:00,consequences shelling mariupol russia literally erasing ukrainian city face earth thousands civilians killed buildings completely destroyed thats putin brought city putinwarcriminal war russiaukrainewar,0,0
1025,1440,PUTINS_NFT,10238,0,2021-11-14 21:46:06+00:00,False,,"MINT IS LIVE 🚨🚨

50% donated to #Ukraine 🇺🇦

11 buyers will receive $1000 each and 1 lucky person will win $20 000 👀

Buy 5 #NFTs and receive 2 FREE NFTs!

🔗Mint: https://t.co/3DQ7mZ4BZ0

#Solana #SolanaNFT #Solanadrop #Putin #RussiaUkraineWar #UkraineWar #UkraineUnderAttack https://t.co/Kizo813xqQ","[0, 275]",29,en,26,2022-03-26 22:00:08+00:00,mint live donated ukraine buyers receive lucky person win buy nfts receive free nfts mint,1,0
1026,1441,IndiaToday,6011296,245,2009-02-02 07:21:54+00:00,True,India,"Putin has signalled multiple times that he is not in favour of NATO’s expansion. While NATO has been expanding, #Russia has also been trying to regain control over post-Soviet countries. So, do Putin’s fears have any ground? 

#Putin #RussiaUkraineWar #NewsMo #RE https://t.co/HvGIUl3T8V","[0, 263]",9,en,1,2022-03-26 22:00:01+00:00,putin signalled multiple times favour natos expansion nato expanding russia also trying regain control postsoviet countries putins fears ground putin russiaukrainewar newsmo,0,0
1027,1442,Cyberknow20,11797,985,2020-07-03 10:51:20+00:00,False,,"#itarmyukraine and #beehive #cybersecurity have collaborated.

#oprussia #infosec #UkraineRussianWar #RussiaUkraineWar #cyberattack https://t.co/1PIWXaumyM","[0, 131]",21,en,3,2022-03-26 21:59:47+00:00,itarmyukraine beehive cybersecurity collaborated oprussia infosec ukrainerussianwar russiaukrainewar cyberattack,0,1
1028,1443,Austin1Andre,2,14,2022-02-24 05:14:39+00:00,False,,"RT @JOURNALISTJIT14: Yesterday in Warsaw, thousands of Ukrainians and Poles lay on the ground, symbolizing the thousands of civilians kille…","[0, 140]",0,en,1,2022-03-26 21:59:27+00:00,yesterday warsaw thousands ukrainians poles lay ground symbolizing thousands civilians kille,0,0
1029,1444,VerseDreami,148,418,2022-03-23 08:06:34+00:00,False,Germany,"RT @VerseDreami: Putin signs another law against Fake News.... *Is it already the first of April? I mean, then they would all have to put t…","[0, 140]",0,en,1,2022-03-26 21:58:44+00:00,putin signs another law fake news already first april mean would put,0,0
1030,1446,EuromaidanPR,87459,3591,2014-01-12 15:28:39+00:00,False,Ukraine,Russia conducts missile strikes on Lviv. What we know so far | EMPR https://t.co/w9xGy4iXkG #RussiaUkraineWar #StopPutin https://t.co/Emank1x5O1,"[0, 120]",45,en,27,2022-03-26 21:58:20+00:00,russia conducts missile strikes lviv know far empr,0,0
1031,1448,Edwardrtjr,35,96,2021-12-10 06:54:38+00:00,False,,"@ChristinaPushaw Do you take it back now??? “For God’s sake, this man can’t stay in power.”This comment just elevated the alert level with #Putin and his nuclear threat or an attack on #NATO. #RussiaUkraineWar","[17, 209]",2,en,0,2022-03-26 21:57:59+00:00,take back gods sake man cant stay powerthis comment elevated alert level putin nuclear threat attack nato russiaukrainewar,0,0
1032,1451,ustweet__,4,16,2021-11-06 16:58:48+00:00,False,,"Russia War in Ukraine, Russia vs NATO News Today, World War 3 News #Russia #Putin #RussiaUkraineConflict #RussiaUkraineWar
#RussianUkrainianWar #NATO #Biden
 https://t.co/QapZ5RKkVR via @YouTube","[0, 194]",0,en,0,2022-03-26 21:56:20+00:00,russia war ukraine russia vs nato news today world war news russia putin russiaukraineconflict russiaukrainewar russianukrainianwar nato biden,0,0
1033,1452,DragonL22541573,62,282,2021-09-01 07:54:32+00:00,False,,"RT @TGTM_Official: 5 millions to Ukraine &amp; 14 millions to Russia - not sure which side is being invaded 🤔

#RussiaUkraineWar
#大翻译运动 #TheGre…","[0, 144]",0,en,265,2022-03-26 21:56:11+00:00,millions ukraine amp millions russia sure side invaded russiaukrainewar thegre,0,0
1034,1457,ustweet__,4,16,2021-11-06 16:58:48+00:00,False,,"Russia War in Ukraine, Russia vs NATO News Today, World War 3 News #ustweet #Russia 
#RussiaUkraine #RussiaUkraineConflict
#RussiaUkraineWar #Putin #NATO #RussianUkrainianWar
https://t.co/QapZ5RKkVR via @YouTube","[0, 211]",0,en,0,2022-03-26 21:55:10+00:00,russia war ukraine russia vs nato news today world war news ustweet russia russiaukraine russiaukraineconflict russiaukrainewar putin nato russianukrainianwar,0,0
1035,1458,chrisalecanada,2785,2616,2008-10-01 05:35:23+00:00,False,Port Alberni - Nuupts’ ikapis,"Start reading about the Suwalki Gap. #Kaliningrad #Poland #Lithuania 
#RussiaUkraineWar https://t.co/FlRttoSwtf","[0, 87]",0,en,0,2022-03-26 21:55:01+00:00,start reading suwalki gap kaliningrad poland lithuania russiaukrainewar,0,0
1036,1461,StrukovSlava,180,342,2010-10-25 09:54:18+00:00,False,Ukraine,"RT @solomonmax: Valery Zaluzhny's 'Goby'. Horror from the depths of Azov Sea

Валерій Залужний ""Бичок"". Жахиття з глибин Азову
#UkraineWins…","[0, 140]",0,und,5,2022-03-26 21:53:23+00:00,valery zaluzhnys goby horror depths azov sea ukrainewins,0,0
1037,1462,OleSpan,295,1101,2012-04-20 20:56:21+00:00,False,Україна,"#RussiaUkraineWar

Professional work of Ukrainian gunners and artillery https://t.co/CUIRmiLAoN","[0, 71]",0,en,0,2022-03-26 21:53:04+00:00,russiaukrainewar professional work ukrainian gunners artillery,0,1
1038,1463,kaleygh78,206,378,2015-10-09 08:47:53+00:00,False,Romania,"RT @EuromaidanPR: #Hungary still does not allow military transports to pass through its airspace to #Ukraine. 

Is it definitely part of @N…","[0, 140]",0,en,102,2022-03-26 21:52:50+00:00,hungary still allow military transports pass airspace ukraine definitely pa,0,0
1039,1464,JulieEcoWarrior,1479,3770,2020-11-29 12:49:48+00:00,False,"Melbourne, Victoria",@simonahac @DaveSharma The fossil fuel ⛽️ billionaires are on a good thing &amp; want to keep it going for as long as possible. Compliant and corruptible politicians are just their tools to maintain the profitable status quo. #RussiaUkraineWar has proven to be a windfall for Saudi Arabia &amp; the OPEC cartel,"[23, 310]",3,en,3,2022-03-26 21:51:54+00:00,fossil fuel billionaires good thing amp want keep going long possible compliant corruptible politicians tools maintain profitable status quo russiaukrainewar proven windfall saudi arabia amp opec cartel,1,0
1040,1465,elmpor82,37,459,2012-01-25 04:01:19+00:00,False,,RT @LenaNechet: Idiotic propaganda: migrating birds to spread ethnic-specific bioweapons from Ukraine - Russian Igor Konashenkov (Игорь Кон…,"[0, 140]",0,und,4,2022-03-26 21:51:33+00:00,idiotic propaganda migrating birds spread ethnicspecific bioweapons ukraine russian igor konashenkov,0,0
1041,1466,DarleMelo,22,297,2022-01-16 20:37:51+00:00,False,,"RT @IndiaToday: What is the situation in Donetsk in Donbass region? Why does the Donbass region want want independence from Ukraine? 

#Rep…","[0, 140]",0,en,20,2022-03-26 21:51:21+00:00,situation donetsk donbass region donbass region want want independence ukraine rep,0,0
1042,1467,MawunyegaKojo,509,5000,2019-06-22 15:38:48+00:00,False,,"RT @ArmedMaidan: ""Nobody understood what was happening. We thought it was training.""

#Russian soldier realized was in a war only when got…","[0, 139]",0,en,5,2022-03-26 21:51:21+00:00,nobody understood happening thought training russian soldier realized war got,0,0
1043,1468,Gaurav64457696,9,88,2019-02-28 11:38:03+00:00,False,,"@nitin_gadkari Sir u hv been doing great work. But don't say #PetrolDieselPrice hiked due to #RussiaUkraineWar .Then why were they high all through last 1 year?
#Mumbai #NitinGadkari https://t.co/4atBBmQobN","[0, 182]",0,en,0,2022-03-26 21:51:10+00:00,sir u hv great work say petroldieselprice hiked due russiaukrainewar high last year mumbai nitingadkari,1,0
1044,1470,NaNurken,94,901,2012-03-19 21:50:02+00:00,False,Ukraine,"RT @YAblunka: ⚠️ The first image made from the movie about the apocalypse!
The second image of #Ukraine, #Rubizhne after the shelling by th…","[0, 140]",0,en,1,2022-03-26 21:50:57+00:00,first image made movie apocalypse second image ukraine rubizhne shelling th,1,0
1045,1471,Damavand_Archer,87,257,2015-01-06 03:40:19+00:00,False,USA,"@vtchakarova French are also lying about Moscow’s #RussiaUkraineWar ? So the only people who tell them truth are East-Europeans, working for @NATO https://t.co/5h43ZNBwgM","[13, 170]",0,en,0,2022-03-26 21:50:47+00:00,french also lying moscows russiaukrainewar people tell truth easteuropeans working,0,0
1046,1472,sahilmishra_04,487,433,2021-08-17 08:38:30+00:00,False,"Uttar Pradesh, India","RT @PrateekPratap5: Eight kangaroos were evacuated from the #Kharkiv Ecopark, said the founder of the park Alexander Feldman.
#UkraineWar #…","[0, 140]",0,en,2,2022-03-26 21:50:37+00:00,eight kangaroos evacuated kharkiv ecopark said founder park alexander feldman ukrainewar,0,0
1047,1473,JuanT97689316,607,1738,2021-02-21 14:57:27+00:00,False,,RT @MilitaryAgentt: #Breaking They write that several soldiers of the Russian Federation (LPR - from Luhansk) originally from Africa were k…,"[0, 140]",0,en,1,2022-03-26 21:50:17+00:00,breaking write several soldiers russian federation lpr luhansk originally africa k,0,0
1048,1475,MawunyegaKojo,509,5000,2019-06-22 15:38:48+00:00,False,,"RT @Boudi23Boudi: So the advisor to President Zelenskyy said this in 2019:

""Our price for joining NATO is a big war with Russia""

He said…","[0, 139]",0,en,1,2022-03-26 21:49:23+00:00,advisor president zelenskyy said price joining nato big war russia said,0,0
1049,1477,vilsrip,3884,4133,2008-08-03 08:59:22+00:00,False,Northern Bavaria,"RT @EmmettLesterSan: This is Dmitry Reznikov, a sign with asterisks got him convicted of 'discrediting Russia's armed forces' and he was fi…","[0, 140]",0,en,12,2022-03-26 21:48:09+00:00,dmitry reznikov sign asterisks got convicted discrediting russias armed forces fi,0,0
1050,1478,ramesh_tgo,73,140,2011-02-04 08:23:08+00:00,False,,"RT @AnnuKaushik253: Biden on Putin: ""This man cannot remain in power."" 👇White House immediately clarifies that Biden wasn't calling for a '…","[0, 140]",0,en,1,2022-03-26 21:47:43+00:00,biden putin man cannot remain power white house immediately clarifies biden calling,0,1
1051,1479,LilianaSilvei20,7,36,2022-02-26 10:17:17+00:00,False,Neverland ,"RT @ArmedMaidan: 11yo Ukrainian girl recovering in hospital after #Russian soldier shot her in the face:CNN

Bullet was lodged in her throa…","[0, 140]",0,en,3,2022-03-26 21:47:43+00:00,yo ukrainian girl recovering hospital russian soldier shot facecnn bullet lodged throa,0,0
1052,1480,MilitaryAgentt,4461,29,2020-04-02 15:36:02+00:00,False,Bruxelles ,"#Breaking They write that several soldiers of the Russian Federation (LPR - from Luhansk) originally from Africa were killed near Rubizhne.

#UkraineWar #UkraineRussianWar #Ukraina #UkraineInvasion #Russian #RussiaUkraineWar #LNR #DNR https://t.co/OCjDT5ahBd","[0, 234]",4,en,1,2022-03-26 21:46:56+00:00,breaking write several soldiers russian federation lpr luhansk originally africa killed near rubizhne ukrainewar ukrainerussianwar ukraina ukraineinvasion russian russiaukrainewar lnr dnr,0,0
1053,1481,TwaddictsRUs,741,2720,2009-08-24 05:02:43+00:00,False,In The Clouds ;-) N.C. USA,".@WithinSyriaBlog blocked u (?) just now for telling the #facts LMAO 🤣🤣
TY for standing up to #misinformation 👍🤗🥰 
#StandWithUkraine  #SlavaUkraini 
#Kharkiv #Kyiv #Russia #Ukraine #UkraineRussiaWar #StopPutin #russiaukrainewar #Putin #Donbass #Luhansk #NATO #WW3 https://t.co/CKM5j800BM https://t.co/MQTQfLys7t","[0, 287]",1,en,0,2022-03-26 21:46:43+00:00,blocked u telling facts lmao ty standing misinformation standwithukraine slavaukraini kharkiv kyiv russia ukraine ukrainerussiawar stopputin russiaukrainewar putin donbass luhansk nato ww,0,0
1054,1483,Sablicorne1,491,1140,2018-07-21 17:05:27+00:00,False,"Habbo Hotel, Kiev.",#Biden in the geopolitical china shop = Borat in the Antiques shop. #BoratBiden #dipLOLmacy #RussiaUkraine #RussiaUkraineConflict #RussiaUkraineCrisis #RussiaUkraineWar #BidensWar #BidensMidtermsWar https://t.co/g0D651QRiZ,"[0, 198]",1,en,1,2022-03-26 21:45:41+00:00,biden geopolitical china shop borat antiques shop boratbiden diplolmacy russiaukraine russiaukraineconflict russiaukrainecrisis russiaukrainewar bidenswar bidensmidtermswar,0,1
1055,1486,aj2squared,310,636,2009-02-07 23:10:34+00:00,False,Planet Earth,"Wanted: Russian revolution to topple tyrant. Internal applicants welcome
#russiaukrainewar #putinmustgo https://t.co/murcyqZhm7","[0, 127]",0,en,0,2022-03-26 21:44:49+00:00,wanted russian revolution topple tyrant internal applicants welcome russiaukrainewar putinmustgo,1,0
1056,1487,Varun8Vijay,55,597,2013-10-24 20:21:26+00:00,False,Bangalore,"RT @timesofindia: Don't even think about moving onto a single inch of Nato territory, Biden warns Putin

#RussiaUkraineWar live updates:

h…","[0, 140]",0,en,7,2022-03-26 21:44:48+00:00,even think moving onto single inch nato territory biden warns putin russiaukrainewar live updates h,0,0
1057,1488,Arc_Light,1890,3236,2009-01-21 01:28:20+00:00,False,British Columbia,No words. Vladimir Putin is a war criminal and must be tried at the International Criminal Court in The Hague. 🤨https://t.co/nLQmd5uCxS #RussiaUkraineWar #RussianWarCrimes,"[0, 171]",1,en,0,2022-03-26 21:44:22+00:00,words vladimir putin war criminal must tried international criminal court hague,0,0
1058,1490,FrancisJeffrey7,3153,4016,2013-12-30 05:32:15+00:00,False,Middle-California,"RT @FrancisJeffrey7: #WilliamBurns #WilliamFBurns #William_F_Burns = #Biden's #CIA Director, &amp; formerly, #US Ambassador in #Ukraine.
He acc…","[0, 144]",0,en,2,2022-03-26 21:43:57+00:00,williamburns williamfburns william_f_burns bidens cia director amp formerly us ambassador ukraine acc,0,1
1059,1492,WolfWoden,91,902,2009-06-16 23:00:04+00:00,False,,#Rusia #RussiaInvadedUkraine #Russia #RussiaUkraineWar #Ukraine #UkraineUnderAttack #Ukrainian #PutinWarCrimes #Putin #PutinHitler https://t.co/mPsA1WsBgX,"[0, 130]",0,und,0,2022-03-26 21:43:22+00:00,rusia russiainvadedukraine russia russiaukrainewar ukraine ukraineunderattack ukrainian putinwarcrimes putin putinhitler,0,0
1060,1493,WolfWoden,91,902,2009-06-16 23:00:04+00:00,False,,#Rusia #RussiaInvadedUkraine #Russia #RussiaUkraineWar #Ukraine #UkraineUnderAttack #Ukrainian #PutinWarCrimes #Putin #PutinHitler https://t.co/mcd6nBk4qy,"[0, 130]",0,und,0,2022-03-26 21:42:52+00:00,rusia russiainvadedukraine russia russiaukrainewar ukraine ukraineunderattack ukrainian putinwarcrimes putin putinhitler,0,0
1061,1494,OmarLutfey,6,24,2011-10-13 02:30:35+00:00,False,"Loveland, Colorado",Soon we get to find out if @Boeing and @Airbus have been quietly installing Lojack on their airplanes. #UkraineWar #RussiaUkraineWar,"[0, 132]",0,en,0,2022-03-26 21:42:49+00:00,soon get find quietly installing lojack airplanes ukrainewar russiaukrainewar,1,0
1062,1496,WolfWoden,91,902,2009-06-16 23:00:04+00:00,False,,#Rusia #RussiaInvadedUkraine #Russia #RussiaUkraineWar #Ukraine #UkraineUnderAttack #Ukrainian #PutinWarCrimes #Putin #PutinHitler https://t.co/P9I3qCtyfU,"[0, 130]",0,und,0,2022-03-26 21:42:37+00:00,rusia russiainvadedukraine russia russiaukrainewar ukraine ukraineunderattack ukrainian putinwarcrimes putin putinhitler,0,0
1063,1499,PBell38334240,1868,4452,2020-03-13 18:03:14+00:00,False,,"PUTIN AND THE RITZ - A Randy Rainbow Song Parody 🇺🇸💘🇷🇺 https://t.co/TQl9IUJSfm via @YouTube
#PutinWarCriminal #IStandWithUkraine #TrumpIsARussianAsset #TrumpCrimeFamily #trumptraitor #RussiaUkraineWar","[0, 200]",1,en,0,2022-03-26 21:41:41+00:00,putin ritz randy rainbow song parody,0,0
1064,1500,pierrelepigeon1,412,1347,2019-09-09 16:20:39+00:00,False,Dans le ciel volant,"RT @EuromaidanPR: Another recently downed #Russian aircraft ""decorates"" #Ukrainian fields, the General Staff of the Armed Forces of #Ukrain…","[0, 140]",0,en,48,2022-03-26 21:41:39+00:00,another recently downed russian aircraft decorates ukrainian fields general staff armed forces ukrain,0,1
1065,1501,SoundmaxDJlive,934,4999,2015-12-03 22:10:43+00:00,False,"Vancouver, BC","Contribute to help Ukraine Humanitarian Projects https://t.co/Le7sIlNkwR 
 #business #sponsors #donors #donate #contribute #Humanitarian #Ukraine #UkraineWar
#Lviv #Karkiv #Kharkiv #Kyiv #refugees #Ukrainians #GoFundMe #PutinWarCrimes #Poland #Moldova #Hungary #RussiaUkraineWar https://t.co/E6W1aaCeER","[0, 278]",0,en,2,2022-03-26 21:40:47+00:00,contribute help ukraine humanitarian projects,0,1
1066,1502,SoundmaxDJlive,934,4999,2015-12-03 22:10:43+00:00,False,"Vancouver, BC","Contribute to help Ukraine Humanitarian Projects https://t.co/Le7sIlNkwR 
 #business #sponsors #donors #donate #contribute #Humanitarian #Ukraine #UkraineWar
#Lviv #Karkiv #Kharkiv #Kyiv #refugees #Ukrainians #GoFundMe #PutinWarCrimes #Poland #Moldova #Hungary #RussiaUkraineWar https://t.co/tgJXGlA89p","[0, 278]",0,en,3,2022-03-26 21:40:17+00:00,contribute help ukraine humanitarian projects,0,1
1067,1503,EkremKu,343,4937,2010-12-01 14:35:43+00:00,False,Germany,"RT @Gugugugagaga3: American volunteers on the battlefield in the Kyiv region

They liberated the village, which had been under Russian occu…","[0, 140]",0,en,7,2022-03-26 21:40:01+00:00,american volunteers battlefield kyiv region liberated village russian occu,0,0
1068,1504,SoundmaxDJlive,934,4999,2015-12-03 22:10:43+00:00,False,"Vancouver, BC","Contribute to help Ukraine Humanitarian Projects https://t.co/Le7sIlNkwR 
 #business #sponsors #donors #donate #contribute #Humanitarian #Ukraine #UkraineWar
#Lviv #Karkiv #Kharkiv #Kyiv #refugees #Ukrainians #GoFundMe #PutinWarCrimes #Poland #Moldova #Hungary #RussiaUkraineWar https://t.co/XhHaioYTGp","[0, 278]",0,en,0,2022-03-26 21:39:59+00:00,contribute help ukraine humanitarian projects,0,1
1069,1505,Imsarrr1,7,124,2020-03-23 00:29:09+00:00,False,,@JoeBiden @POTUS #HunterBiden @TheDemocrats are directly responsible for the corruption and war. Yet our justice system isn't gonna hold them accountable because politicians and their families are apparently above the law. #APAC #BidenCrimeFamilly #RussiaUkraineWar #Corruption https://t.co/AntexB2rha,"[0, 277]",1,en,0,2022-03-26 21:39:59+00:00,hunterbiden directly responsible corruption war yet justice system gonna hold accountable politicians families apparently law apac bidencrimefamilly russiaukrainewar corruption,0,1
1070,1507,SoundmaxDJlive,934,4999,2015-12-03 22:10:43+00:00,False,"Vancouver, BC","Contribute to help Ukraine Humanitarian Projects https://t.co/Le7sIlNkwR 
 #business #sponsors #donors #donate #contribute #Humanitarian #Ukraine #UkraineWar
#Lviv #Karkiv #Kharkiv #Kyiv #refugees #Ukrainians #GoFundMe #PutinWarCrimes #Poland #Moldova #Hungary #RussiaUkraineWar https://t.co/h8h2ULjhp8","[0, 278]",0,en,2,2022-03-26 21:39:30+00:00,contribute help ukraine humanitarian projects,0,1
1071,1509,EricJan98937709,751,1212,2021-04-18 18:24:19+00:00,False,"Northern Cape, Kimberly ","RT @UkraineRussiaW3: ❗️The moment the missile hit Kurenivka

#Ukraine #RussiaUkraineWar https://t.co/g3Zyk34MCG","[0, 111]",0,et,6,2022-03-26 21:38:56+00:00,moment missile hit kurenivka ukraine russiaukrainewar,0,0
